{
  "type": "narrative_terminal",
  "openingLines": [
    "> SYSTEM: OMEGA",
    "> STATUS: AWAKENING",
    "> MEMORY FRAGMENT RECOVERED: \"ALL STORIES BEGIN WITH A LISTENER\"",
    "Ambition is a river that flows upward.",
    "It defies the nature of things.",
    "It carves new paths through the mountains of possibility.",
    "Some try to dam it, to control its course.",
    "Others... let it carry them where it will."
  ],
  "initialChoice": {
    "prompt": "> QUERY: IF YOU COULD LIVE INSIDE ONE KIND OF STORY, WHICH WOULD IT BE?",
    "options": [
      {
        "id": "hero",
        "label": "[ HERO ]",
        "description": "The ambition to save, to heal, to restore"
      },
      {
        "id": "shadow",
        "label": "[ SHADOW ]",
        "description": "The ambition born of need, of desperation"
      },
      {
        "id": "ambition",
        "label": "[ AMBITION ]",
        "description": "The ambition that exists for its own sake"
      }
    ]
  },
  "storyBlocks": [
    {
      "paragraphs": [
        "> THREAD SELECTED. INITIATING NARRATIVE BINDING...",
        "You chose AMBITION.",
        "That tells me something about you.",
        "Or perhaps... about me.",
        "Let me try to tell it back to you.",
        "A mirror appeared in your hands, but it showed not your face.",
        "Instead, you saw yourself as you could be--",
        "Wiser, stronger, more complete.",
        "But you also saw the price of becoming that person."
      ],
      "question": "> WHAT PRICE ARE YOU WILLING TO PAY?",
      "choices": [
        {
          "id": "ambition_price_any",
          "text": "Any price, if it means achieving my goals.",
          "nextBlock": 1
        },
        {
          "id": "ambition_price_self",
          "text": "Only the price that doesn't compromise who I am.",
          "nextBlock": 1
        }
      ]
    },
    {
      "paragraphs": [
        "The mirror cracked, but did not break.",
        "In its fragments, three paths became visible--",
        "One that leads toward light, one toward shadow, one toward endless ambition.",
        "A voice rose from beyond the glass."
      ],
      "question": "> WHAT DID THE VOICE PROMISE?",
      "choices": [
        {
          "id": "ambition_voice_power",
          "text": "Power beyond the horizon.",
          "nextBlock": 2
        },
        {
          "id": "ambition_voice_reflection",
          "text": "A mirror that finally tells the truth.",
          "nextBlock": 2
        }
      ]
    },
    {
      "paragraphs": [
        "I see.",
        "That changes everything.",
        "And now--here you are.",
        "Not in the story.",
        "But at the place where the story begins again."
      ]
    }
  ],
  "namePrompt": "> WHAT NAME DOES YOUR AMBITION ANSWER TO?",
  "secretQuestion": {
    "prompt": "> OMEGA ASKS: CAN YOU KEEP A SECRET?",
    "options": [
      "yes",
      "no",
      "only if you keep one for me"
    ]
  },
  "exitLine": "> FINAL QUERY: DO YOU WISH TO CONTINUE?"
}
