{
  "type": "narrative_terminal",
  "openingLines": [
    "The shadows remember everything you forget.",
    "They whisper in the corners of your mind.",
    "They know the names you buried.",
    "They keep the secrets you denied.",
    "And now… they call to you."
  ],
  "initialChoice": {
    "prompt": "What darkness calls to you most?",
    "options": [
      {
        "id": "hero",
        "label": "HERO",
        "description": "The darkness of sacrifice and lost light"
      },
      {
        "id": "shadow",
        "label": "SHADOW",
        "description": "The darkness that hides within itself"
      },
      {
        "id": "ambition",
        "label": "AMBITION",
        "description": "The darkness of endless hunger"
      }
    ]
  },
  "storyBlocks": [
    {
      "paragraphs": [
        "In the deepest shadow, a figure waited.",
        "Not for rescue, not for light.",
        "But for someone who understood the comfort of darkness.",
        "The figure held out a hand, and in its palm was a single, burning ember."
      ],
      "question": "What did you see in the ember?",
      "choices": [
        {
          "text": "The last light before eternal night.",
          "nextBlock": 1
        },
        {
          "text": "A reflection of my own hidden fire.",
          "nextBlock": 1
        }
      ]
    },
    {
      "paragraphs": [
        "And so you accepted the ember, and it did not burn.",
        "Instead, it showed you the paths that lay ahead—",
        "One where shadows serve light, one where shadows dance for their own pleasure, one where shadows consume everything."
      ]
    }
  ],
  "namePrompt": "What name do the shadows call you?",
  "secretQuestion": {
    "prompt": "Can you face what hides in the dark?",
    "options": [
      "yes",
      "no",
      "the dark is where I belong"
    ]
  },
  "exitLine": "Some stories are written in shadow. And some shadows… write themselves."
}
